<?xml version="1.0" encoding="UTF-8"?>
<schema xmlns="http://www.w3.org/2001/XMLSchema"
targetNamespace="http://jd02_09.dkruchek.it.by"
xmlns:tns="http://jd02_09.dkruchek.it.by"
elementFormDefault="qualified">
    <element name="Persons">
        <complexType>
            <sequence>
                <element name="Person"
                         type="tns:Person"
                         maxOccurs="unbounded">
                </element>
            </sequence>
        </complexType>
    </element>
    <complexType name="Person">
        <sequence>
            <element name="Login" type="string"/>
            <element name="Password" type="string"/>
            <element name="Email" type="string"/>
            <element name="Ads" type="tns:Ads"/>
        </sequence>
    </complexType>
    <complexType name="Ads">
        <sequence>
            <element name="Ad"
                     type="tns:Ad"
                     maxOccurs="unbounded"/>
        </sequence>
    </complexType>
    <complexType name="Ad">
        <sequence>
            <element name="Description" type="string"/>
            <element name="Address" type="string"/>
            <element name="Price" type="tns:Price"/>
            <element name="Area" type="double"/>
            <element name="Floor" type="positiveInteger"/>
            <element name="Floors" type="positiveInteger"/>
            <element name="Rooms" type="positiveInteger"/>
        </sequence>
    </complexType>
    <complexType name="Price">
        <simpleContent>
            <extension base="double">
                <attribute name="currency"
                            type="string"
                            use="required">
                </attribute>
            </extension>
        </simpleContent>
    </complexType>
</schema>

