<?xml version="1.0" encoding="UTF-8" ?>
<Persons xmlns="http://jd02_09.shekh.it.by"
         xmlns:xsi="http://www.w3.org/2001/XMLSchema-instance"
         xsi:schemaLocation="http://jd02_09.shekh.it.by Schema.xsd"
>
    <Person>
        <Login>Stanis</Login>
        <Password>Qwerty12345</Password>
        <Email>sts.shekh@gmail.com</Email>
        <Ads>
            <Ad>
                <Description>
                    Шикарная квартира в самом центре за дорого!
                </Description>
                <Address>
                    ул. Ленина д.1 кв.13
                </Address>
                <Price currency="$$$$">123456.0</Price>
                <Area>55.5</Area>
                <Floor>3</Floor>
                <Floors>5</Floors>
                <Rooms>2</Rooms>
            </Ad>
            <Ad>
                <Description>
                    Нешикарная квартира не в центре за дешево.
                </Description>
                <Address>
                    ул. Космическая д.3 кв.16
                </Address>
                <Price currency="EU">44444.0</Price>
                <Area>44.4</Area>
                <Floor>4</Floor>
                <Floors>4</Floors>
                <Rooms>2</Rooms>
            </Ad>
        </Ads>
    </Person>
    <Person>
        <Login>Fedya</Login>
        <Password>asdfg12345</Password>
        <Email>fedya12345@mail.ru</Email>
        <Ads>
            <Ad>
                <Description>
                    Однокомнатная квартира!
                </Description>
                <Address>
                    ул. Ленина д.1 кв.1.
                </Address>
                <Price currency="BYN">999999.0</Price>
                <Area>55.5</Area>
                <Floor>1</Floor>
                <Floors>5</Floors>
                <Rooms>1</Rooms>
            </Ad>
        </Ads>
    </Person>
</Persons>

