<?xml version="1.0" encoding="UTF-8"?>
<Persons xmlns="http://jd02_09.gavrilchik.it.by"
          xmlns:xsi="http://www.w3.org/2001/XMLSchema-instance"
         xsi:schemaLocation="http://jd02_09.gavrilchik.it.by Schema.xsd"
>
    <Person>
        <Login>Vasya</Login>
        <Password>qwerty12345</Password>
        <Email>vasya12345@mail.ru</Email>
        <Ads>
              <Ad>
                  <Description>
                      Superior flat in the center expensive!
                  </Description>
                  <Address>
                      13-1, Lenina ave.
                  </Address>
                  <Price currency="EU">123456.0</Price>
                  <Area>55.5</Area>
                  <Floor>3</Floor>
                  <Floors>5</Floors>
                  <Rooms>2</Rooms>
              </Ad>
            <Ad>
            <Description>
                Economy flat in the center cheap!
            </Description>
            <Address>
                16-3, Kosmicheskaya str.
            </Address>
            <Price currency="USD">44444.0</Price>
            <Area>44.4</Area>
            <Floor>4</Floor>
            <Floors>4</Floors>
                <Rooms>3</Rooms>
        </Ad>
        </Ads>
    </Person>
    <Person>
        <Login>Fedya</Login>
        <Password>asdfg12345</Password>
        <Email>fedya12345@mail.ru</Email>
        <Ads>
            <Ad>
                <Description>
                    One room flat!
                </Description>
                <Address>
                    1-1, Lenina ave.
                </Address>
                <Price currency="BYN">999999.0</Price>
                <Area>55.5</Area>
                <Floor>1</Floor>
                <Floors>5</Floors>
                <Rooms>1</Rooms>
            </Ad>

        </Ads>
    </Person>
</Persons>
